lastReplyOrigin,oldComplainId,additionalFields,moderationUserName,companyName,otherProblemType,solved,dealAgain,otherProductType,titleMasked,type,evaluation,contentPoliciesViolation,score,userState,userRequestedDelete,requesterName,additionalInfo,modified,id,evaluated,presence,publishedEmailSent,deletionReason,read,marketplaceComplain,created,maskingStatus,ip,moderationReasonDescription,frozen,requestEvaluation,moderateReason,policiesViolationScore,deletedDate,files,problemType,deletedIp,companyIndexes,status,companyShortname,userCity,indexable,description,phones,title,failedToValidatePolicies,interactions,complainOrigin,firstInteractionDate,hasReply,compliment,legacyId,company,userEmail,contentViolatesPolicies,productType,address,canBeEvaluated,userName,url,inModeration,moderateRequested,deleted,complainMediaInfos,fantasyName,category,descriptionMasked,user
,,,****,Claro,,False,,,Cobrança de seguro não autorizado em aparelho Motorola G35,,,,,RJ,False,,,2026-04-06T08:22:31,xlPMFXGL4_qMCh6o,False,SERVICE_OFF,,****,True,,2026-04-06T08:22:19,MASKED,****,****,False,,,0,,,0000000000000075,****,"['{averageAnswerTime=0.0, finalScore=1.3, totalNotAnswered=75806, totalComplains=92639, consumerScore=1.37, created=2026-04-06T03:32:39, start=2025-10-01T00:00:00, solvedPercentual=19.9, type=SIX_MONTHS, totalAnswered=0, totalComplains30=15649, averageAnswerTime3M=0.0, hasStamp=false, dealAgainPercentual=16.6, totalEvaluated=16833, answeredPercentual=0.0, company=7712, end=2026-03-31T23:59:59, id=37288821-eee6-4b4c-91cb-b45cffcdcf25, status=NOT_RECOMMENDED}', '{averageAnswerTime=0.0, finalScore=1.4, totalNotAnswered=138635, totalComplains=178088, consumerScore=1.43, created=2026-04-06T03:32:39, start=2025-04-01T00:00:00, solvedPercentual=21.0, type=TWELVE_MONTHS, totalAnswered=0, totalComplains30=15649, averageAnswerTime3M=0.0, hasStamp=false, dealAgainPercentual=17.4, totalEvaluated=39453, answeredPercentual=0.0, company=7712, end=2026-03-31T23:59:59, id=35bd6e96-0909-4c57-82df-1fa7a648a76b, status=NOT_RECOMMENDED}', '{averageAnswerTime=0.0, finalScore=1.5, totalNotAnswered=129101, totalComplains=171479, consumerScore=1.51, created=2026-04-06T03:32:39, start=2025-01-01T00:00:00, solvedPercentual=22.5, type=LAST_YEAR, totalAnswered=0, totalComplains30=15649, averageAnswerTime3M=0.0, hasStamp=false, dealAgainPercentual=18.2, totalEvaluated=42378, answeredPercentual=0.0, company=7712, end=2025-12-31T23:59:59, id=de8d1738-36c6-407d-b560-34fe60acb65e, status=NOT_RECOMMENDED}', '{averageAnswerTime=8519429.777777778, finalScore=1.9, totalNotAnswered=98307, totalComplains=139323, consumerScore=1.96, created=2026-04-06T03:32:39, start=2024-01-01T00:00:00, solvedPercentual=29.1, type=PAST_LAST_YEAR, totalAnswered=9, totalComplains30=15649, averageAnswerTime3M=0.0, hasStamp=false, dealAgainPercentual=23.1, totalEvaluated=41013, answeredPercentual=0.0, company=7712, end=2024-12-31T23:59:59, id=296a1d53-77a0-4cea-9c91-eed471a54472, status=NOT_RECOMMENDED}', '{averageAnswerTime=8382413.2, finalScore=1.8, totalNotAnswered=331615, totalComplains=447755, consumerScore=1.81, created=2026-04-06T03:32:39, start=2023-04-07T00:00:00, solvedPercentual=27.8, type=LAST_THREE_YEARS, totalAnswered=15, totalComplains30=15649, averageAnswerTime3M=0.0, hasStamp=false, dealAgainPercentual=21.5, totalEvaluated=116136, answeredPercentual=0.0, company=7712, end=2026-04-06T23:59:59, id=c026d9a1-960e-4cc7-9aaf-761d8804d8e3, status=NOT_RECOMMENDED}']",PENDING,claro,Rio de Janeiro,,"No dia 27/03/2026, realizei a compra de um aparelho Motorola G35 e fui surpreendido com a inclusão de um seguro sem minha autoriza",,Cobrança de seguro não autorizado em aparelho Motorola G35,,[],,,False,False,245219583,7712,****,,0000000000001395,****,,****,cobranca-de-seguro-nao-autorizado-em-aparelho-motorola-g35_xlPMFXGL4_qMCh6o,False,,False,[],Claro,0000000000000064,"No dia 27/03/2026, realizei a compra de um aparelho Motorola G35 e fui surpreendido com a inclusão de um seguro sem minha autorização ou consentimento prévio.<br/><br/>Em nenhum momento o seguro foi ofertado ou explicado durante a venda. Apenas ao final fui informado de que já estava incluso no valor do aparelho como se fosse um benefício, o que considero uma prática abusiva.<br/><br/>Ao entrar em contato pelo telefone *****, fui orientado de forma incorreta que o cancelamento só poderia ser feito pela própria loja que realizou a venda, o que dificulta a solução do problema.<br/><br/>Protocolo de atendimento: não informado no contato telefônico.<br/><br/>Solicito com urgência:<br/><br/>Cancelamento imediato do seguro;<br/><br/>Estorno integral do valor cobrado indevidamente.<br/><br/>Aguardo retorno e solução rápida, pois trata-se de cobrança sem autorização, ferindo meus direitos como consumido",
,,,****,Claro,,False,,,Cancelamento de assinatura Claro Internet e cobrança indevida,,,,,RJ,False,,,2026-04-06T08:14:42,tnwEinR-2Jy0FYjQ,False,,,****,True,,2026-04-06T08:14:31,MASKED,****,****,False,,,0,,,0000000000000075,****,"['{averageAnswerTime=0.0, finalScore=1.3, totalNotAnswered=75806, totalComplains=92639, consumerScore=1.37, created=2026-04-06T03:32:39, start=2025-10-01T00:00:00, solvedPercentual=19.9, type=SIX_MONTHS, totalAnswered=0, totalComplains30=15649, averageAnswerTime3M=0.0, hasStamp=false, dealAgainPercentual=16.6, totalEvaluated=16833, answeredPercentual=0.0, company=7712, end=2026-03-31T23:59:59, id=37288821-eee6-4b4c-91cb-b45cffcdcf25, status=NOT_RECOMMENDED}', '{averageAnswerTime=0.0, finalScore=1.4, totalNotAnswered=138635, totalComplains=178088, consumerScore=1.43, created=2026-04-06T03:32:39, start=2025-04-01T00:00:00, solvedPercentual=21.0, type=TWELVE_MONTHS, totalAnswered=0, totalComplains30=15649, averageAnswerTime3M=0.0, hasStamp=false, dealAgainPercentual=17.4, totalEvaluated=39453, answeredPercentual=0.0, company=7712, end=2026-03-31T23:59:59, id=35bd6e96-0909-4c57-82df-1fa7a648a76b, status=NOT_RECOMMENDED}', '{averageAnswerTime=0.0, finalScore=1.5, totalNotAnswered=129101, totalComplains=171479, consumerScore=1.51, created=2026-04-06T03:32:39, start=2025-01-01T00:00:00, solvedPercentual=22.5, type=LAST_YEAR, totalAnswered=0, totalComplains30=15649, averageAnswerTime3M=0.0, hasStamp=false, dealAgainPercentual=18.2, totalEvaluated=42378, answeredPercentual=0.0, company=7712, end=2025-12-31T23:59:59, id=de8d1738-36c6-407d-b560-34fe60acb65e, status=NOT_RECOMMENDED}', '{averageAnswerTime=8519429.777777778, finalScore=1.9, totalNotAnswered=98307, totalComplains=139323, consumerScore=1.96, created=2026-04-06T03:32:39, start=2024-01-01T00:00:00, solvedPercentual=29.1, type=PAST_LAST_YEAR, totalAnswered=9, totalComplains30=15649, averageAnswerTime3M=0.0, hasStamp=false, dealAgainPercentual=23.1, totalEvaluated=41013, answeredPercentual=0.0, company=7712, end=2024-12-31T23:59:59, id=296a1d53-77a0-4cea-9c91-eed471a54472, status=NOT_RECOMMENDED}', '{averageAnswerTime=8382413.2, finalScore=1.8, totalNotAnswered=331615, totalComplains=447755, consumerScore=1.81, created=2026-04-06T03:32:39, start=2023-04-07T00:00:00, solvedPercentual=27.8, type=LAST_THREE_YEARS, totalAnswered=15, totalComplains30=15649, averageAnswerTime3M=0.0, hasStamp=false, dealAgainPercentual=21.5, totalEvaluated=116136, answeredPercentual=0.0, company=7712, end=2026-04-06T23:59:59, id=c026d9a1-960e-4cc7-9aaf-761d8804d8e3, status=NOT_RECOMMENDED}']",PENDING,claro,Rio de Janeiro,,Cancelei uma assinatura da Claro Internet em um antigo endereço na loja do Barra Shoping no dia 29/03/3026 com a entrega do equipa,,Cancelamento de assinatura Claro Internet e cobrança indevida,,[],,,False,False,245219115,7712,****,False,0000000000000478,****,,****,cancelamento-de-assinatura-claro-internet-e-cobranca-indevida_tnwEinR-2Jy0FYjQ,False,,False,[],Claro,0000000000000069,Cancelei uma assinatura da Claro Internet em um antigo endereço na loja do Barra Shoping no dia 29/03/3026 com a entrega do equipamento. Desde então tenho recebido muitas ligações da Claro tornando - se muito inconveniente. Na data de ontem e de hoje recebi mensagem do assistente virtual querendo agendar a retirada do equipamento que já foi entregue na loja.Solicito não ser mais incomodado com esse assunto.,
,,,****,Claro,,False,,,Claro aumenta conta e dificulta cancelamento com cobrança de multa abusiva.,,,,,PE,False,,,2026-04-06T08:10:21,4W5jL-syqxK_scra,False,SERVICE_OFF,,****,True,,2026-04-06T08:10:06,MASKED,****,****,False,,,40,,,0000000000000075,****,"['{averageAnswerTime=0.0, finalScore=1.3, totalNotAnswered=75806, totalComplains=92639, consumerScore=1.37, created=2026-04-06T03:32:39, start=2025-10-01T00:00:00, solvedPercentual=19.9, type=SIX_MONTHS, totalAnswered=0, totalComplains30=15649, averageAnswerTime3M=0.0, hasStamp=false, dealAgainPercentual=16.6, totalEvaluated=16833, answeredPercentual=0.0, company=7712, end=2026-03-31T23:59:59, id=37288821-eee6-4b4c-91cb-b45cffcdcf25, status=NOT_RECOMMENDED}', '{averageAnswerTime=0.0, finalScore=1.4, totalNotAnswered=138635, totalComplains=178088, consumerScore=1.43, created=2026-04-06T03:32:39, start=2025-04-01T00:00:00, solvedPercentual=21.0, type=TWELVE_MONTHS, totalAnswered=0, totalComplains30=15649, averageAnswerTime3M=0.0, hasStamp=false, dealAgainPercentual=17.4, totalEvaluated=39453, answeredPercentual=0.0, company=7712, end=2026-03-31T23:59:59, id=35bd6e96-0909-4c57-82df-1fa7a648a76b, status=NOT_RECOMMENDED}', '{averageAnswerTime=0.0, finalScore=1.5, totalNotAnswered=129101, totalComplains=171479, consumerScore=1.51, created=2026-04-06T03:32:39, start=2025-01-01T00:00:00, solvedPercentual=22.5, type=LAST_YEAR, totalAnswered=0, totalComplains30=15649, averageAnswerTime3M=0.0, hasStamp=false, dealAgainPercentual=18.2, totalEvaluated=42378, answeredPercentual=0.0, company=7712, end=2025-12-31T23:59:59, id=de8d1738-36c6-407d-b560-34fe60acb65e, status=NOT_RECOMMENDED}', '{averageAnswerTime=8519429.777777778, finalScore=1.9, totalNotAnswered=98307, totalComplains=139323, consumerScore=1.96, created=2026-04-06T03:32:39, start=2024-01-01T00:00:00, solvedPercentual=29.1, type=PAST_LAST_YEAR, totalAnswered=9, totalComplains30=15649, averageAnswerTime3M=0.0, hasStamp=false, dealAgainPercentual=23.1, totalEvaluated=41013, answeredPercentual=0.0, company=7712, end=2024-12-31T23:59:59, id=296a1d53-77a0-4cea-9c91-eed471a54472, status=NOT_RECOMMENDED}', '{averageAnswerTime=8382413.2, finalScore=1.8, totalNotAnswered=331615, totalComplains=447755, consumerScore=1.81, created=2026-04-06T03:32:39, start=2023-04-07T00:00:00, solvedPercentual=27.8, type=LAST_THREE_YEARS, totalAnswered=15, totalComplains30=15649, averageAnswerTime3M=0.0, hasStamp=false, dealAgainPercentual=21.5, totalEvaluated=116136, answeredPercentual=0.0, company=7712, end=2026-04-06T23:59:59, id=c026d9a1-960e-4cc7-9aaf-761d8804d8e3, status=NOT_RECOMMENDED}']",PENDING,claro,Jaboatão dos Guararapes,,"Estive na Claro em outubro de 2025 para trocar meu telefone, comprei meu telefone a preço cheio, né? A primeira pergunta que eu fi",,Claro aumenta conta e dificulta cancelamento com cobrança de multa abusiva.,,[],,,False,False,245218901,7712,****,,0000000000000474,****,,****,claro-aumenta-conta-e-dificulta-cancelamento-com-cobranca-de-multa-abusiva_4W5jL-syqxK_scra,False,,False,['AUDIO_TRANSCRIPTION'],Claro,0000000000000067,"Estive na Claro em outubro de 2025 para trocar meu telefone, comprei meu telefone a preço cheio, né? A primeira pergunta que eu fiz à vendedora foi se teria aumento da minha conta, que eu já pagava 139. Ela disse que não. Pediu para que eu assinasse um documento, porque eu tinha um chip virtual, para poder refazer esse chip. Assinei. Em novembro, veio 177 reais. Eu na minha correria, porque quando a gente liga para a Claro, desligam, tem que passar para outra pessoa e isso e aquilo, deixei pra lá. Mas hoje, ao tentar pagar minha conta, minha conta está em 197 reais. Depois de duas horas de insistência, um atendente chamado ***** disse Olhe, a senhora tem que ir na loja. Como se eu estou ligando para o central de atendimento. Aí eu disse pronto, mas me explique por quê de 170 foi para 200. Ele disse que foi um aumento de gigabytes de internet. Eu disse, mas eu não solicitei. Se você tem algum vídeo, algum áudio meu solicitando ou algum documento que eu assinei ou mesmo disse que não, abriu uma chamada financeira. Aí eu disse olha, meu telefone não recebe chamadas de números que não são salvos. E aí ele disse que se eu quisesse ter um retorno, eu teria que ligar. Tá ligando pra Claro. Número de chamada *****. Deixo bem clara a minha insatisfação com a operadora. Ainda eu fui ameaçada que se eu cancelar, eu pago uma multa de 1500 reais.",
,,,****,Claro,,False,,,Péssimo atendimento e cobrança indevida de conta após retirada de desconto sem aviso prévio,,,,,RJ,False,,,2026-04-06T08:06:27,1haXYqi95zzEvwM0,False,SERVICE_OFF,,****,True,,2026-04-06T08:06:14,MASKED,****,****,False,,,0,,,"0000000000000075,0000000000000002",****,"['{averageAnswerTime=0.0, finalScore=1.3, totalNotAnswered=75806, totalComplains=92639, consumerScore=1.37, created=2026-04-06T03:32:39, start=2025-10-01T00:00:00, solvedPercentual=19.9, type=SIX_MONTHS, totalAnswered=0, totalComplains30=15649, averageAnswerTime3M=0.0, hasStamp=false, dealAgainPercentual=16.6, totalEvaluated=16833, answeredPercentual=0.0, company=7712, end=2026-03-31T23:59:59, id=37288821-eee6-4b4c-91cb-b45cffcdcf25, status=NOT_RECOMMENDED}', '{averageAnswerTime=0.0, finalScore=1.4, totalNotAnswered=138635, totalComplains=178088, consumerScore=1.43, created=2026-04-06T03:32:39, start=2025-04-01T00:00:00, solvedPercentual=21.0, type=TWELVE_MONTHS, totalAnswered=0, totalComplains30=15649, averageAnswerTime3M=0.0, hasStamp=false, dealAgainPercentual=17.4, totalEvaluated=39453, answeredPercentual=0.0, company=7712, end=2026-03-31T23:59:59, id=35bd6e96-0909-4c57-82df-1fa7a648a76b, status=NOT_RECOMMENDED}', '{averageAnswerTime=0.0, finalScore=1.5, totalNotAnswered=129101, totalComplains=171479, consumerScore=1.51, created=2026-04-06T03:32:39, start=2025-01-01T00:00:00, solvedPercentual=22.5, type=LAST_YEAR, totalAnswered=0, totalComplains30=15649, averageAnswerTime3M=0.0, hasStamp=false, dealAgainPercentual=18.2, totalEvaluated=42378, answeredPercentual=0.0, company=7712, end=2025-12-31T23:59:59, id=de8d1738-36c6-407d-b560-34fe60acb65e, status=NOT_RECOMMENDED}', '{averageAnswerTime=8519429.777777778, finalScore=1.9, totalNotAnswered=98307, totalComplains=139323, consumerScore=1.96, created=2026-04-06T03:32:39, start=2024-01-01T00:00:00, solvedPercentual=29.1, type=PAST_LAST_YEAR, totalAnswered=9, totalComplains30=15649, averageAnswerTime3M=0.0, hasStamp=false, dealAgainPercentual=23.1, totalEvaluated=41013, answeredPercentual=0.0, company=7712, end=2024-12-31T23:59:59, id=296a1d53-77a0-4cea-9c91-eed471a54472, status=NOT_RECOMMENDED}', '{averageAnswerTime=8382413.2, finalScore=1.8, totalNotAnswered=331615, totalComplains=447755, consumerScore=1.81, created=2026-04-06T03:32:39, start=2023-04-07T00:00:00, solvedPercentual=27.8, type=LAST_THREE_YEARS, totalAnswered=15, totalComplains30=15649, averageAnswerTime3M=0.0, hasStamp=false, dealAgainPercentual=21.5, totalEvaluated=116136, answeredPercentual=0.0, company=7712, end=2026-04-06T23:59:59, id=c026d9a1-960e-4cc7-9aaf-761d8804d8e3, status=NOT_RECOMMENDED}']",PENDING,claro,Niterói,,Péssimo atendimento pelo telefone. Resolveram tirar o desconto que tinha na minha linha sem qualquer aviso prévio e a conta veio q,,Péssimo atendimento e cobrança indevida de conta após retirada de desconto sem aviso prévio,,[],,,False,False,245218711,7712,****,,0000000000000472,****,,****,pessimo-atendimento-e-cobranca-indevida-de-conta-apos-retirada-de-desconto-sem-aviso-previo_1haXYqi95zzEvwM0,False,,False,[],Claro,0000000000000067,"Péssimo atendimento pelo telefone. Resolveram tirar o desconto que tinha na minha linha sem qualquer aviso prévio e a conta veio quase 150 reais a mais. Fui falar com a atendente e ela não fez a mínima questao de ajudar, mesno eu solicitando cancelamento dos meus pacotes. Todo mes tenho problemas com essa operadora. Esperando apenas para cancelar os produtos e buscar algo melhor.",
,,,****,Claro,,False,,,Reclamação: Interrupções semanais na internet e cobranças indevidas prejudicam trabalho em home office,,,,,RJ,False,,,2026-04-06T08:05:01,xr36rRiJRnIKn_Nr,False,,,****,True,,2026-04-06T08:04:49,MASKED,****,****,False,,,0,,,0000000000000875,****,"['{averageAnswerTime=0.0, finalScore=1.3, totalNotAnswered=75806, totalComplains=92639, consumerScore=1.37, created=2026-04-06T03:32:39, start=2025-10-01T00:00:00, solvedPercentual=19.9, type=SIX_MONTHS, totalAnswered=0, totalComplains30=15649, averageAnswerTime3M=0.0, hasStamp=false, dealAgainPercentual=16.6, totalEvaluated=16833, answeredPercentual=0.0, company=7712, end=2026-03-31T23:59:59, id=37288821-eee6-4b4c-91cb-b45cffcdcf25, status=NOT_RECOMMENDED}', '{averageAnswerTime=0.0, finalScore=1.4, totalNotAnswered=138635, totalComplains=178088, consumerScore=1.43, created=2026-04-06T03:32:39, start=2025-04-01T00:00:00, solvedPercentual=21.0, type=TWELVE_MONTHS, totalAnswered=0, totalComplains30=15649, averageAnswerTime3M=0.0, hasStamp=false, dealAgainPercentual=17.4, totalEvaluated=39453, answeredPercentual=0.0, company=7712, end=2026-03-31T23:59:59, id=35bd6e96-0909-4c57-82df-1fa7a648a76b, status=NOT_RECOMMENDED}', '{averageAnswerTime=0.0, finalScore=1.5, totalNotAnswered=129101, totalComplains=171479, consumerScore=1.51, created=2026-04-06T03:32:39, start=2025-01-01T00:00:00, solvedPercentual=22.5, type=LAST_YEAR, totalAnswered=0, totalComplains30=15649, averageAnswerTime3M=0.0, hasStamp=false, dealAgainPercentual=18.2, totalEvaluated=42378, answeredPercentual=0.0, company=7712, end=2025-12-31T23:59:59, id=de8d1738-36c6-407d-b560-34fe60acb65e, status=NOT_RECOMMENDED}', '{averageAnswerTime=8519429.777777778, finalScore=1.9, totalNotAnswered=98307, totalComplains=139323, consumerScore=1.96, created=2026-04-06T03:32:39, start=2024-01-01T00:00:00, solvedPercentual=29.1, type=PAST_LAST_YEAR, totalAnswered=9, totalComplains30=15649, averageAnswerTime3M=0.0, hasStamp=false, dealAgainPercentual=23.1, totalEvaluated=41013, answeredPercentual=0.0, company=7712, end=2024-12-31T23:59:59, id=296a1d53-77a0-4cea-9c91-eed471a54472, status=NOT_RECOMMENDED}', '{averageAnswerTime=8382413.2, finalScore=1.8, totalNotAnswered=331615, totalComplains=447755, consumerScore=1.81, created=2026-04-06T03:32:39, start=2023-04-07T00:00:00, solvedPercentual=27.8, type=LAST_THREE_YEARS, totalAnswered=15, totalComplains30=15649, averageAnswerTime3M=0.0, hasStamp=false, dealAgainPercentual=21.5, totalEvaluated=116136, answeredPercentual=0.0, company=7712, end=2026-04-06T23:59:59, id=c026d9a1-960e-4cc7-9aaf-761d8804d8e3, status=NOT_RECOMMENDED}']",PENDING,claro,Rio de Janeiro,,"Gostaria de registrar uma reclamação formal sobre o serviço de internet que venho recebendo. Toda semana fico sem conexão, o que t",,Reclamação: Interrupções semanais na internet e cobranças indevidas prejudicam trabalho em home office,,[],,,False,False,245218651,7712,****,False,0000000000000478,****,,****,reclamacao-interrupcoes-semanais-na-internet-e-cobrancas-indevidas-prejudicam-trabalho-em-home-office_xr36rRiJRnIKn_Nr,False,,False,[],Claro,0000000000000069,"Gostaria de registrar uma reclamação formal sobre o serviço de internet que venho recebendo. Toda semana fico sem conexão, o que tem prejudicado diretamente o meu trabalho, já que atuo em home office. Essa situação tem se tornado recorrente e extremamente desgastante.<br/><br/>Além da instabilidade frequente, continuo recebendo faturas com valores elevados, o que não condiz com a qualidade do serviço prestado. Ressalto que no meu bairro não há ocorrências de roubo de fios ou qualquer justificativa aparente para essas interrupções constantes.<br/><br/>Diante disso, solicito uma solução definitiva para o problema, bem como uma revisão dos valores cobrados, considerando os transtornos causados. Caso não haja uma resolução, terei que considerar a troca de operadora e outras medidas cabíveis.<br/><br/>Aguardo um posicionamento urgente.",
,,,****,Claro,,False,,,"Instabilidade constante no serviço de Wi-Fi da Claro, com falhas frequentes e cobrança integral da fatura.",,,,,SP,False,,,2026-04-06T07:52:32,BmbWpu8AE_obFBPi,False,SERVICE_OFF,,****,True,,2026-04-06T07:52:19,MASKED,****,****,False,,,10,,,0000000000000875,****,"['{averageAnswerTime=0.0, finalScore=1.3, totalNotAnswered=75806, totalComplains=92639, consumerScore=1.37, created=2026-04-06T03:32:39, start=2025-10-01T00:00:00, solvedPercentual=19.9, type=SIX_MONTHS, totalAnswered=0, totalComplains30=15649, averageAnswerTime3M=0.0, hasStamp=false, dealAgainPercentual=16.6, totalEvaluated=16833, answeredPercentual=0.0, company=7712, end=2026-03-31T23:59:59, id=37288821-eee6-4b4c-91cb-b45cffcdcf25, status=NOT_RECOMMENDED}', '{averageAnswerTime=0.0, finalScore=1.4, totalNotAnswered=138635, totalComplains=178088, consumerScore=1.43, created=2026-04-06T03:32:39, start=2025-04-01T00:00:00, solvedPercentual=21.0, type=TWELVE_MONTHS, totalAnswered=0, totalComplains30=15649, averageAnswerTime3M=0.0, hasStamp=false, dealAgainPercentual=17.4, totalEvaluated=39453, answeredPercentual=0.0, company=7712, end=2026-03-31T23:59:59, id=35bd6e96-0909-4c57-82df-1fa7a648a76b, status=NOT_RECOMMENDED}', '{averageAnswerTime=0.0, finalScore=1.5, totalNotAnswered=129101, totalComplains=171479, consumerScore=1.51, created=2026-04-06T03:32:39, start=2025-01-01T00:00:00, solvedPercentual=22.5, type=LAST_YEAR, totalAnswered=0, totalComplains30=15649, averageAnswerTime3M=0.0, hasStamp=false, dealAgainPercentual=18.2, totalEvaluated=42378, answeredPercentual=0.0, company=7712, end=2025-12-31T23:59:59, id=de8d1738-36c6-407d-b560-34fe60acb65e, status=NOT_RECOMMENDED}', '{averageAnswerTime=8519429.777777778, finalScore=1.9, totalNotAnswered=98307, totalComplains=139323, consumerScore=1.96, created=2026-04-06T03:32:39, start=2024-01-01T00:00:00, solvedPercentual=29.1, type=PAST_LAST_YEAR, totalAnswered=9, totalComplains30=15649, averageAnswerTime3M=0.0, hasStamp=false, dealAgainPercentual=23.1, totalEvaluated=41013, answeredPercentual=0.0, company=7712, end=2024-12-31T23:59:59, id=296a1d53-77a0-4cea-9c91-eed471a54472, status=NOT_RECOMMENDED}', '{averageAnswerTime=8382413.2, finalScore=1.8, totalNotAnswered=331615, totalComplains=447755, consumerScore=1.81, created=2026-04-06T03:32:39, start=2023-04-07T00:00:00, solvedPercentual=27.8, type=LAST_THREE_YEARS, totalAnswered=15, totalComplains30=15649, averageAnswerTime3M=0.0, hasStamp=false, dealAgainPercentual=21.5, totalEvaluated=116136, answeredPercentual=0.0, company=7712, end=2026-04-06T23:59:59, id=c026d9a1-960e-4cc7-9aaf-761d8804d8e3, status=NOT_RECOMMENDED}']",PENDING,claro,Carapicuíba,,Wifi há mais de 1 mês com instabilidade. Toda segunda e terça feira amanheço sem sinal de internet. Ligo na Claro pra saber o que ,,"Instabilidade constante no serviço de Wi-Fi da Claro, com falhas frequentes e cobrança integral da fatura.",,[],,,False,False,245218139,7712,****,,0000000000000478,****,,****,instabilidade-constante-no-servico-de-wi-fi-da-claro-com-falhas-frequentes-e-cobranca-integral-da-fatura_BmbWpu8AE_obFBPi,False,,False,[],Claro,0000000000000069,"Wifi há mais de 1 mês com instabilidade. Toda segunda e terça feira amanheço sem sinal de internet. Ligo na Claro pra saber o que ta acontecendo e um robô me informa que é problema na minha região. Os atendentes não sabem passar uma informação decente, só passam prazos absurdos de volta do sinal daqui a 20h. A fatura do mês seguinte sempre vem com o valor cheio, mesmo que eu esteja passando dias e dias do mês sem sinal de wifi. Trabalho em casa e não posso ficar sem Internet vários dias no mês como vem ocorrendo. O serviço da Claro ja foi bom, mas isso faz muito muito muito tempo. Ultimamente é o pior serviço que eu ja tive, só me traz prejuízo porque o sinal cai o tempo todo, e isso quando tem sinal de wifi! Vou trocar minha internet para a Vivo, não aguento mais essa falta de respeito e [Editado pelo Reclame Aqui] que a Claro vem fazendo!",
