lastReplyOrigin,oldComplainId,additionalFields,moderationUserName,companyName,otherProblemType,solved,dealAgain,otherProductType,titleMasked,type,evaluation,contentPoliciesViolation,score,userState,userRequestedDelete,requesterName,additionalInfo,modified,id,evaluated,presence,publishedEmailSent,deletionReason,read,marketplaceComplain,created,maskingStatus,ip,moderationReasonDescription,frozen,requestEvaluation,moderateReason,policiesViolationScore,deletedDate,files,problemType,deletedIp,companyIndexes,status,companyShortname,userCity,indexable,description,phones,title,failedToValidatePolicies,interactions,complainOrigin,firstInteractionDate,hasReply,compliment,legacyId,company,userEmail,contentViolatesPolicies,productType,address,canBeEvaluated,userName,url,inModeration,moderateRequested,deleted,complainMediaInfos,fantasyName,category,descriptionMasked,user
,,,****,Claro,,False,,,Claro: Cobrança indevida de débito inexistente mesmo após contato telefônico e aplicativo confirmarem inexistência da dívida.,,,,,PR,False,,,2026-04-06T09:50:13,9caiy3ekpbsLd9Mc,False,SERVICE_OFF,,****,True,,2026-04-06T09:49:58,MASKED,****,****,False,,,10,,,0000000000000075,****,"['{averageAnswerTime=0.0, finalScore=1.3, totalNotAnswered=75806, totalComplains=92639, consumerScore=1.37, created=2026-04-06T03:32:39, start=2025-10-01T00:00:00, solvedPercentual=19.9, type=SIX_MONTHS, totalAnswered=0, totalComplains30=15649, averageAnswerTime3M=0.0, hasStamp=false, dealAgainPercentual=16.6, totalEvaluated=16833, answeredPercentual=0.0, company=7712, end=2026-03-31T23:59:59, id=37288821-eee6-4b4c-91cb-b45cffcdcf25, status=NOT_RECOMMENDED}', '{averageAnswerTime=0.0, finalScore=1.4, totalNotAnswered=138635, totalComplains=178088, consumerScore=1.43, created=2026-04-06T03:32:39, start=2025-04-01T00:00:00, solvedPercentual=21.0, type=TWELVE_MONTHS, totalAnswered=0, totalComplains30=15649, averageAnswerTime3M=0.0, hasStamp=false, dealAgainPercentual=17.4, totalEvaluated=39453, answeredPercentual=0.0, company=7712, end=2026-03-31T23:59:59, id=35bd6e96-0909-4c57-82df-1fa7a648a76b, status=NOT_RECOMMENDED}', '{averageAnswerTime=0.0, finalScore=1.5, totalNotAnswered=129101, totalComplains=171479, consumerScore=1.51, created=2026-04-06T03:32:39, start=2025-01-01T00:00:00, solvedPercentual=22.5, type=LAST_YEAR, totalAnswered=0, totalComplains30=15649, averageAnswerTime3M=0.0, hasStamp=false, dealAgainPercentual=18.2, totalEvaluated=42378, answeredPercentual=0.0, company=7712, end=2025-12-31T23:59:59, id=de8d1738-36c6-407d-b560-34fe60acb65e, status=NOT_RECOMMENDED}', '{averageAnswerTime=8519429.777777778, finalScore=1.9, totalNotAnswered=98307, totalComplains=139323, consumerScore=1.96, created=2026-04-06T03:32:39, start=2024-01-01T00:00:00, solvedPercentual=29.1, type=PAST_LAST_YEAR, totalAnswered=9, totalComplains30=15649, averageAnswerTime3M=0.0, hasStamp=false, dealAgainPercentual=23.1, totalEvaluated=41013, answeredPercentual=0.0, company=7712, end=2024-12-31T23:59:59, id=296a1d53-77a0-4cea-9c91-eed471a54472, status=NOT_RECOMMENDED}', '{averageAnswerTime=8382413.2, finalScore=1.8, totalNotAnswered=331615, totalComplains=447755, consumerScore=1.81, created=2026-04-06T03:32:39, start=2023-04-07T00:00:00, solvedPercentual=27.8, type=LAST_THREE_YEARS, totalAnswered=15, totalComplains30=15649, averageAnswerTime3M=0.0, hasStamp=false, dealAgainPercentual=21.5, totalEvaluated=116136, answeredPercentual=0.0, company=7712, end=2026-04-06T23:59:59, id=c026d9a1-960e-4cc7-9aaf-761d8804d8e3, status=NOT_RECOMMENDED}']",PENDING,claro,Curitiba,,"Tenho contrato com a Claro há muito tempo e, recentemente (Dezembro de 2025), assinei um pacote Claro Multi (Banda larga e celular",,Claro: Cobrança indevida de débito inexistente mesmo após contato telefônico e aplicativo confirmarem inexistência da dívida.,,[],,,False,False,245228689,7712,****,,0000000000000474,****,,****,claro-cobranca-indevida-de-debito-inexistente-mesmo-apos-contato-telefonico-e-aplicativo-confirmarem-inexistencia-da-divida_9caiy3ekpbsLd9Mc,False,,False,[],Claro,0000000000000067,"Tenho contrato com a Claro há muito tempo e, recentemente (Dezembro de 2025), assinei um pacote Claro Multi (Banda larga e celulares) pelo valor promocional de R$ 144,00.Ao realizar o contrato, fizemos pela modalidade débito automático, com o desconto direto em conta e assim, não precisaria ter preocupação em pagar os boletos.Contudo, desde fevereiro de 2026 (02/2026) venho recebendo mensagens via whatsapp, sms e e-mails do Serasa (promovendo tentativas de renegociações e consultas no meu cpf), na tentativa de cobrar um débito de janeiro de 2026.Também recebo e-mails do &quot;Acordo Certo&quot; cobrando a mesma dívida.No entanto, em consulta ao APP &quot;minha claro&quot; não existem parcelas em aberto de débitos antigos, somente as vincendas (10 de abril de 2026).Em 20 de fevereiro de 2026 já entrei em contato com a Claro via telefone, onde eles mesmo informaram que não há débitos em aberto.Desta forma, venho por meio dessa solicitar providências visando a baixa das cobranças indevidas, antes de ter algum prejuízo maior para mim.",
,,,****,Claro,,False,,,Cobrança indevida de serviços de streaming e dificuldade de contato com a empresa.,,,,,SP,False,,,2026-04-06T09:49:37,5QADdb6WXDZiRjtV,False,SERVICE_OFF,,****,True,,2026-04-06T09:49:24,MASKED,****,****,False,,,10,,,0000000000000075,****,"['{averageAnswerTime=0.0, finalScore=1.3, totalNotAnswered=75806, totalComplains=92639, consumerScore=1.37, created=2026-04-06T03:32:39, start=2025-10-01T00:00:00, solvedPercentual=19.9, type=SIX_MONTHS, totalAnswered=0, totalComplains30=15649, averageAnswerTime3M=0.0, hasStamp=false, dealAgainPercentual=16.6, totalEvaluated=16833, answeredPercentual=0.0, company=7712, end=2026-03-31T23:59:59, id=37288821-eee6-4b4c-91cb-b45cffcdcf25, status=NOT_RECOMMENDED}', '{averageAnswerTime=0.0, finalScore=1.4, totalNotAnswered=138635, totalComplains=178088, consumerScore=1.43, created=2026-04-06T03:32:39, start=2025-04-01T00:00:00, solvedPercentual=21.0, type=TWELVE_MONTHS, totalAnswered=0, totalComplains30=15649, averageAnswerTime3M=0.0, hasStamp=false, dealAgainPercentual=17.4, totalEvaluated=39453, answeredPercentual=0.0, company=7712, end=2026-03-31T23:59:59, id=35bd6e96-0909-4c57-82df-1fa7a648a76b, status=NOT_RECOMMENDED}', '{averageAnswerTime=0.0, finalScore=1.5, totalNotAnswered=129101, totalComplains=171479, consumerScore=1.51, created=2026-04-06T03:32:39, start=2025-01-01T00:00:00, solvedPercentual=22.5, type=LAST_YEAR, totalAnswered=0, totalComplains30=15649, averageAnswerTime3M=0.0, hasStamp=false, dealAgainPercentual=18.2, totalEvaluated=42378, answeredPercentual=0.0, company=7712, end=2025-12-31T23:59:59, id=de8d1738-36c6-407d-b560-34fe60acb65e, status=NOT_RECOMMENDED}', '{averageAnswerTime=8519429.777777778, finalScore=1.9, totalNotAnswered=98307, totalComplains=139323, consumerScore=1.96, created=2026-04-06T03:32:39, start=2024-01-01T00:00:00, solvedPercentual=29.1, type=PAST_LAST_YEAR, totalAnswered=9, totalComplains30=15649, averageAnswerTime3M=0.0, hasStamp=false, dealAgainPercentual=23.1, totalEvaluated=41013, answeredPercentual=0.0, company=7712, end=2024-12-31T23:59:59, id=296a1d53-77a0-4cea-9c91-eed471a54472, status=NOT_RECOMMENDED}', '{averageAnswerTime=8382413.2, finalScore=1.8, totalNotAnswered=331615, totalComplains=447755, consumerScore=1.81, created=2026-04-06T03:32:39, start=2023-04-07T00:00:00, solvedPercentual=27.8, type=LAST_THREE_YEARS, totalAnswered=15, totalComplains30=15649, averageAnswerTime3M=0.0, hasStamp=false, dealAgainPercentual=21.5, totalEvaluated=116136, answeredPercentual=0.0, company=7712, end=2026-04-06T23:59:59, id=c026d9a1-960e-4cc7-9aaf-761d8804d8e3, status=NOT_RECOMMENDED}']",PENDING,claro,São Paulo,,"Identifiquei que estão sendo incluídos valores referentes a TV e serviços de streaming, sendo que não contratei nenhum pacote adic",,Cobrança indevida de serviços de streaming e dificuldade de contato com a empresa.,,[],,,False,False,245228611,7712,****,,0000000000000475,****,,****,cobranca-indevida-de-servicos-de-streaming-e-dificuldade-de-contato-com-a-empresa_5QADdb6WXDZiRjtV,False,,False,[],Claro,0000000000000068,"Identifiquei que estão sendo incluídos valores referentes a TV e serviços de streaming, sendo que não contratei nenhum pacote adicional além do plano básico. Ressalto que não faço uso de qualquer serviço de streaming que justifique essa cobrança.<br/><br/>Além da cobrança indevida, enfrento grande dificuldade para resolver a situação diretamente com a empresa, pois não consigo contato efetivo pelos canais de atendimento. As tentativas realizadas não resultaram em solução ou esclarecimento adequado.<br/><br/>Diante disso, solicito:<br/><br/>A imediata verificação e correção da cobrança indevida;<br/>O cancelamento de qualquer serviço não autorizado;<br/>A restituição dos valores cobrados indevidamente, conforme previsto no Código de Defesa do Consumidor;<br/>Um posicionamento claro e formal sobre o ocorrido.<br/><br/>Caso a situação não seja resolvida com urgência, tomarei as medidas cabíveis junto aos órgãos de defesa do consumidor.<br/><br/>Aguardo retorno.",
,,,****,Claro,,False,,,Cobrança indevida após cancelamento de contrato e inclusão no Serasa,,,,,SP,False,,,2026-04-06T09:49:00,H43pdy_9jLfT42jJ,False,SERVICE_OFF,,****,True,,2026-04-06T09:48:48,MASKED,****,****,False,,,0,,,0000000000000075,****,"['{averageAnswerTime=0.0, finalScore=1.3, totalNotAnswered=75806, totalComplains=92639, consumerScore=1.37, created=2026-04-06T03:32:39, start=2025-10-01T00:00:00, solvedPercentual=19.9, type=SIX_MONTHS, totalAnswered=0, totalComplains30=15649, averageAnswerTime3M=0.0, hasStamp=false, dealAgainPercentual=16.6, totalEvaluated=16833, answeredPercentual=0.0, company=7712, end=2026-03-31T23:59:59, id=37288821-eee6-4b4c-91cb-b45cffcdcf25, status=NOT_RECOMMENDED}', '{averageAnswerTime=0.0, finalScore=1.4, totalNotAnswered=138635, totalComplains=178088, consumerScore=1.43, created=2026-04-06T03:32:39, start=2025-04-01T00:00:00, solvedPercentual=21.0, type=TWELVE_MONTHS, totalAnswered=0, totalComplains30=15649, averageAnswerTime3M=0.0, hasStamp=false, dealAgainPercentual=17.4, totalEvaluated=39453, answeredPercentual=0.0, company=7712, end=2026-03-31T23:59:59, id=35bd6e96-0909-4c57-82df-1fa7a648a76b, status=NOT_RECOMMENDED}', '{averageAnswerTime=0.0, finalScore=1.5, totalNotAnswered=129101, totalComplains=171479, consumerScore=1.51, created=2026-04-06T03:32:39, start=2025-01-01T00:00:00, solvedPercentual=22.5, type=LAST_YEAR, totalAnswered=0, totalComplains30=15649, averageAnswerTime3M=0.0, hasStamp=false, dealAgainPercentual=18.2, totalEvaluated=42378, answeredPercentual=0.0, company=7712, end=2025-12-31T23:59:59, id=de8d1738-36c6-407d-b560-34fe60acb65e, status=NOT_RECOMMENDED}', '{averageAnswerTime=8519429.777777778, finalScore=1.9, totalNotAnswered=98307, totalComplains=139323, consumerScore=1.96, created=2026-04-06T03:32:39, start=2024-01-01T00:00:00, solvedPercentual=29.1, type=PAST_LAST_YEAR, totalAnswered=9, totalComplains30=15649, averageAnswerTime3M=0.0, hasStamp=false, dealAgainPercentual=23.1, totalEvaluated=41013, answeredPercentual=0.0, company=7712, end=2024-12-31T23:59:59, id=296a1d53-77a0-4cea-9c91-eed471a54472, status=NOT_RECOMMENDED}', '{averageAnswerTime=8382413.2, finalScore=1.8, totalNotAnswered=331615, totalComplains=447755, consumerScore=1.81, created=2026-04-06T03:32:39, start=2023-04-07T00:00:00, solvedPercentual=27.8, type=LAST_THREE_YEARS, totalAnswered=15, totalComplains30=15649, averageAnswerTime3M=0.0, hasStamp=false, dealAgainPercentual=21.5, totalEvaluated=116136, answeredPercentual=0.0, company=7712, end=2026-04-06T23:59:59, id=c026d9a1-960e-4cc7-9aaf-761d8804d8e3, status=NOT_RECOMMENDED}']",PENDING,claro,São Paulo,,"Encerrei meu contrato com a Claro em Dezembro/2025 (contrato *****), onde informa até hoje que os serviços foram cancelados e assi",,Cobrança indevida após cancelamento de contrato e inclusão no Serasa,,[],,,False,False,245228557,7712,****,,0000000000000475,****,,****,cobranca-indevida-apos-cancelamento-de-contrato-e-inclusao-no-serasa_H43pdy_9jLfT42jJ,False,,False,[],Claro,0000000000000068,"Encerrei meu contrato com a Claro em Dezembro/2025 (contrato *****), onde informa até hoje que os serviços foram cancelados e assim inativos. Não deixei nenhum valor atrasado. Em janeiro/2026 veio uma cobrança de R$ 36 aproximadamente e acabei realizando o pagamento, achando ser o resquício do serviço. <br/><br/>Ocorre que mensalmente vem sendo cobrado um Serviço da PREMIERE HD ANUAL Bl AVULSO de R$ 29,92, ou seja, um serviço avulso que vem jogando mensalmente, no qual não consigo nem utilizar, devido ao contrato estar cancelado, e tive que contratar o mesmo serviço diretamente pela GloboPlay. <br/><br/>Não concordo com a cobrança mensalmente, bem como meu nome já foi para a restrição do Serasa. <br/><br/>Quero o cancelamento do serviço e das cobranças, bem como a retirada do meu nome do Serasa.",
,,,****,Claro,,False,,,Cobrança indevida após solicitação de transferência de endereço e inclusão indevida no Serasa.,,,,,MG,False,,,2026-04-06T09:46:49,JePC4Ma8ba-S57Aw,False,SERVICE_OFF,,****,True,,2026-04-06T09:46:37,MASKED,****,****,False,,,10,,,0000000000000075,****,"['{averageAnswerTime=0.0, finalScore=1.3, totalNotAnswered=75806, totalComplains=92639, consumerScore=1.37, created=2026-04-06T03:32:39, start=2025-10-01T00:00:00, solvedPercentual=19.9, type=SIX_MONTHS, totalAnswered=0, totalComplains30=15649, averageAnswerTime3M=0.0, hasStamp=false, dealAgainPercentual=16.6, totalEvaluated=16833, answeredPercentual=0.0, company=7712, end=2026-03-31T23:59:59, id=37288821-eee6-4b4c-91cb-b45cffcdcf25, status=NOT_RECOMMENDED}', '{averageAnswerTime=0.0, finalScore=1.4, totalNotAnswered=138635, totalComplains=178088, consumerScore=1.43, created=2026-04-06T03:32:39, start=2025-04-01T00:00:00, solvedPercentual=21.0, type=TWELVE_MONTHS, totalAnswered=0, totalComplains30=15649, averageAnswerTime3M=0.0, hasStamp=false, dealAgainPercentual=17.4, totalEvaluated=39453, answeredPercentual=0.0, company=7712, end=2026-03-31T23:59:59, id=35bd6e96-0909-4c57-82df-1fa7a648a76b, status=NOT_RECOMMENDED}', '{averageAnswerTime=0.0, finalScore=1.5, totalNotAnswered=129101, totalComplains=171479, consumerScore=1.51, created=2026-04-06T03:32:39, start=2025-01-01T00:00:00, solvedPercentual=22.5, type=LAST_YEAR, totalAnswered=0, totalComplains30=15649, averageAnswerTime3M=0.0, hasStamp=false, dealAgainPercentual=18.2, totalEvaluated=42378, answeredPercentual=0.0, company=7712, end=2025-12-31T23:59:59, id=de8d1738-36c6-407d-b560-34fe60acb65e, status=NOT_RECOMMENDED}', '{averageAnswerTime=8519429.777777778, finalScore=1.9, totalNotAnswered=98307, totalComplains=139323, consumerScore=1.96, created=2026-04-06T03:32:39, start=2024-01-01T00:00:00, solvedPercentual=29.1, type=PAST_LAST_YEAR, totalAnswered=9, totalComplains30=15649, averageAnswerTime3M=0.0, hasStamp=false, dealAgainPercentual=23.1, totalEvaluated=41013, answeredPercentual=0.0, company=7712, end=2024-12-31T23:59:59, id=296a1d53-77a0-4cea-9c91-eed471a54472, status=NOT_RECOMMENDED}', '{averageAnswerTime=8382413.2, finalScore=1.8, totalNotAnswered=331615, totalComplains=447755, consumerScore=1.81, created=2026-04-06T03:32:39, start=2023-04-07T00:00:00, solvedPercentual=27.8, type=LAST_THREE_YEARS, totalAnswered=15, totalComplains30=15649, averageAnswerTime3M=0.0, hasStamp=false, dealAgainPercentual=21.5, totalEvaluated=116136, answeredPercentual=0.0, company=7712, end=2026-04-06T23:59:59, id=c026d9a1-960e-4cc7-9aaf-761d8804d8e3, status=NOT_RECOMMENDED}']",PENDING,claro,Belo Horizonte,,Meu nome se encontra no Serasa sendo que pedi transferência de endereço em dezembro. tenho 2 linhas de internet residencial ativos,,Cobrança indevida após solicitação de transferência de endereço e inclusão indevida no Serasa.,,[],,,False,False,245228265,7712,****,,0000000000000478,****,,****,cobranca-indevida-apos-solicitacao-de-transferencia-de-endereco-e-inclusao-indevida-no-serasa_JePC4Ma8ba-S57Aw,False,,False,[],Claro,0000000000000069,Meu nome se encontra no Serasa sendo que pedi transferência de endereço em dezembro. tenho 2 linhas de internet residencial ativos,
,,,****,Claro,,False,,Claro Net,Impossibilidade de Cancelamento da Claro Net por Telefone - Ligação Cai Constantemente,,,,,MG,False,,,2026-04-06T09:45:37,l3ckS07npTi7LNHD,False,SERVICE_OFF,,****,True,,2026-04-06T09:45:25,MASKED,****,****,False,,,10,,,0000000000001227,****,"['{averageAnswerTime=0.0, finalScore=1.3, totalNotAnswered=75806, totalComplains=92639, consumerScore=1.37, created=2026-04-06T03:32:39, start=2025-10-01T00:00:00, solvedPercentual=19.9, type=SIX_MONTHS, totalAnswered=0, totalComplains30=15649, averageAnswerTime3M=0.0, hasStamp=false, dealAgainPercentual=16.6, totalEvaluated=16833, answeredPercentual=0.0, company=7712, end=2026-03-31T23:59:59, id=37288821-eee6-4b4c-91cb-b45cffcdcf25, status=NOT_RECOMMENDED}', '{averageAnswerTime=0.0, finalScore=1.4, totalNotAnswered=138635, totalComplains=178088, consumerScore=1.43, created=2026-04-06T03:32:39, start=2025-04-01T00:00:00, solvedPercentual=21.0, type=TWELVE_MONTHS, totalAnswered=0, totalComplains30=15649, averageAnswerTime3M=0.0, hasStamp=false, dealAgainPercentual=17.4, totalEvaluated=39453, answeredPercentual=0.0, company=7712, end=2026-03-31T23:59:59, id=35bd6e96-0909-4c57-82df-1fa7a648a76b, status=NOT_RECOMMENDED}', '{averageAnswerTime=0.0, finalScore=1.5, totalNotAnswered=129101, totalComplains=171479, consumerScore=1.51, created=2026-04-06T03:32:39, start=2025-01-01T00:00:00, solvedPercentual=22.5, type=LAST_YEAR, totalAnswered=0, totalComplains30=15649, averageAnswerTime3M=0.0, hasStamp=false, dealAgainPercentual=18.2, totalEvaluated=42378, answeredPercentual=0.0, company=7712, end=2025-12-31T23:59:59, id=de8d1738-36c6-407d-b560-34fe60acb65e, status=NOT_RECOMMENDED}', '{averageAnswerTime=8519429.777777778, finalScore=1.9, totalNotAnswered=98307, totalComplains=139323, consumerScore=1.96, created=2026-04-06T03:32:39, start=2024-01-01T00:00:00, solvedPercentual=29.1, type=PAST_LAST_YEAR, totalAnswered=9, totalComplains30=15649, averageAnswerTime3M=0.0, hasStamp=false, dealAgainPercentual=23.1, totalEvaluated=41013, answeredPercentual=0.0, company=7712, end=2024-12-31T23:59:59, id=296a1d53-77a0-4cea-9c91-eed471a54472, status=NOT_RECOMMENDED}', '{averageAnswerTime=8382413.2, finalScore=1.8, totalNotAnswered=331615, totalComplains=447755, consumerScore=1.81, created=2026-04-06T03:32:39, start=2023-04-07T00:00:00, solvedPercentual=27.8, type=LAST_THREE_YEARS, totalAnswered=15, totalComplains30=15649, averageAnswerTime3M=0.0, hasStamp=false, dealAgainPercentual=21.5, totalEvaluated=116136, answeredPercentual=0.0, company=7712, end=2026-04-06T23:59:59, id=c026d9a1-960e-4cc7-9aaf-761d8804d8e3, status=NOT_RECOMMENDED}']",PENDING,claro,Betim,,"Tem dois dias que estou tentando ligar no ***** da claro pra cancelar minha net pois mudei de endereço, e não completa a ligação. ",,Impossibilidade de Cancelamento da Claro Net por Telefone - Ligação Cai Constantemente,,[],,,False,False,245228111,7712,****,,,****,,****,impossibilidade-de-cancelamento-da-claro-net-por-telefone-ligacao-cai-constantemente_l3ckS07npTi7LNHD,False,,False,[],Claro,0000000000000067,"Tem dois dias que estou tentando ligar no ***** da claro pra cancelar minha net pois mudei de endereço, e não completa a ligação. A atendente virtual diz pra continuar na linha e depois de alguns segundos a ligação cai. Preciso cancelar pois não irei mais usar.",
,,,****,Claro,,False,,Claro Flex,Cobrança indevida de plano de celular não contratado,,,,,MG,False,,,2026-04-06T09:44:35,nlZZkyIMer96b-Ez,False,SERVICE_OFF,,****,True,,2026-04-06T09:44:23,MASKED,****,****,False,,,10,,,0000000000000075,****,"['{averageAnswerTime=0.0, finalScore=1.3, totalNotAnswered=75806, totalComplains=92639, consumerScore=1.37, created=2026-04-06T03:32:39, start=2025-10-01T00:00:00, solvedPercentual=19.9, type=SIX_MONTHS, totalAnswered=0, totalComplains30=15649, averageAnswerTime3M=0.0, hasStamp=false, dealAgainPercentual=16.6, totalEvaluated=16833, answeredPercentual=0.0, company=7712, end=2026-03-31T23:59:59, id=37288821-eee6-4b4c-91cb-b45cffcdcf25, status=NOT_RECOMMENDED}', '{averageAnswerTime=0.0, finalScore=1.4, totalNotAnswered=138635, totalComplains=178088, consumerScore=1.43, created=2026-04-06T03:32:39, start=2025-04-01T00:00:00, solvedPercentual=21.0, type=TWELVE_MONTHS, totalAnswered=0, totalComplains30=15649, averageAnswerTime3M=0.0, hasStamp=false, dealAgainPercentual=17.4, totalEvaluated=39453, answeredPercentual=0.0, company=7712, end=2026-03-31T23:59:59, id=35bd6e96-0909-4c57-82df-1fa7a648a76b, status=NOT_RECOMMENDED}', '{averageAnswerTime=0.0, finalScore=1.5, totalNotAnswered=129101, totalComplains=171479, consumerScore=1.51, created=2026-04-06T03:32:39, start=2025-01-01T00:00:00, solvedPercentual=22.5, type=LAST_YEAR, totalAnswered=0, totalComplains30=15649, averageAnswerTime3M=0.0, hasStamp=false, dealAgainPercentual=18.2, totalEvaluated=42378, answeredPercentual=0.0, company=7712, end=2025-12-31T23:59:59, id=de8d1738-36c6-407d-b560-34fe60acb65e, status=NOT_RECOMMENDED}', '{averageAnswerTime=8519429.777777778, finalScore=1.9, totalNotAnswered=98307, totalComplains=139323, consumerScore=1.96, created=2026-04-06T03:32:39, start=2024-01-01T00:00:00, solvedPercentual=29.1, type=PAST_LAST_YEAR, totalAnswered=9, totalComplains30=15649, averageAnswerTime3M=0.0, hasStamp=false, dealAgainPercentual=23.1, totalEvaluated=41013, answeredPercentual=0.0, company=7712, end=2024-12-31T23:59:59, id=296a1d53-77a0-4cea-9c91-eed471a54472, status=NOT_RECOMMENDED}', '{averageAnswerTime=8382413.2, finalScore=1.8, totalNotAnswered=331615, totalComplains=447755, consumerScore=1.81, created=2026-04-06T03:32:39, start=2023-04-07T00:00:00, solvedPercentual=27.8, type=LAST_THREE_YEARS, totalAnswered=15, totalComplains30=15649, averageAnswerTime3M=0.0, hasStamp=false, dealAgainPercentual=21.5, totalEvaluated=116136, answeredPercentual=0.0, company=7712, end=2026-04-06T23:59:59, id=c026d9a1-960e-4cc7-9aaf-761d8804d8e3, status=NOT_RECOMMENDED}']",PENDING,claro,Belo Horizonte,,"Recebi uma cobrança de 30 reais no meu cartão de crédito, endereçada para &quot;Claro Flex Rec&quot;. Não possuo plano de celular ",,Cobrança indevida de plano de celular não contratado,,[],,,False,False,245227985,7712,****,,,****,,****,cobranca-indevida-de-plano-de-celular-nao-contratado_nlZZkyIMer96b-Ez,False,,False,[],Claro,0000000000000067,"Recebi uma cobrança de 30 reais no meu cartão de crédito, endereçada para &quot;Claro Flex Rec&quot;. Não possuo plano de celular da Claro e não registrei meu cartão de crédito no serviço, pois sempre faço pagamento via pix mensalmente, apenas da internet da minha residência. Não possuo plano de celular e nem disponibilizei meus dados, mesmo se tivessem sido disponibilizados, a cobrança é indevida.",
