lastReplyOrigin,oldComplainId,additionalFields,moderationUserName,companyName,otherProblemType,solved,dealAgain,otherProductType,titleMasked,type,evaluation,contentPoliciesViolation,score,userState,userRequestedDelete,requesterName,additionalInfo,modified,id,evaluated,presence,publishedEmailSent,deletionReason,read,marketplaceComplain,created,maskingStatus,ip,moderationReasonDescription,frozen,requestEvaluation,moderateReason,policiesViolationScore,deletedDate,files,problemType,deletedIp,companyIndexes,status,companyShortname,userCity,indexable,description,phones,title,failedToValidatePolicies,interactions,complainOrigin,firstInteractionDate,hasReply,compliment,legacyId,company,userEmail,contentViolatesPolicies,productType,address,canBeEvaluated,userName,url,inModeration,moderateRequested,deleted,complainMediaInfos,fantasyName,category,descriptionMasked,user
,,,****,Claro,,False,,Serviço Técnico Residencial,Reclamação sobre Atendimento Técnico: Serviço Mal Executado,,,,,SP,False,,,2026-04-06T11:18:22,6r3L-tfF3JjmWpSH,False,SERVICE_OFF,,****,True,,2026-04-06T11:18:09,MASKED,****,****,False,,,0,,,0000000000000017,****,"['{averageAnswerTime=0.0, finalScore=1.3, totalNotAnswered=75806, totalComplains=92639, consumerScore=1.37, created=2026-04-06T03:32:39, start=2025-10-01T00:00:00, solvedPercentual=19.9, type=SIX_MONTHS, totalAnswered=0, totalComplains30=15649, averageAnswerTime3M=0.0, hasStamp=false, dealAgainPercentual=16.6, totalEvaluated=16833, answeredPercentual=0.0, company=7712, end=2026-03-31T23:59:59, id=37288821-eee6-4b4c-91cb-b45cffcdcf25, status=NOT_RECOMMENDED}', '{averageAnswerTime=0.0, finalScore=1.4, totalNotAnswered=138635, totalComplains=178088, consumerScore=1.43, created=2026-04-06T03:32:39, start=2025-04-01T00:00:00, solvedPercentual=21.0, type=TWELVE_MONTHS, totalAnswered=0, totalComplains30=15649, averageAnswerTime3M=0.0, hasStamp=false, dealAgainPercentual=17.4, totalEvaluated=39453, answeredPercentual=0.0, company=7712, end=2026-03-31T23:59:59, id=35bd6e96-0909-4c57-82df-1fa7a648a76b, status=NOT_RECOMMENDED}', '{averageAnswerTime=0.0, finalScore=1.5, totalNotAnswered=129101, totalComplains=171479, consumerScore=1.51, created=2026-04-06T03:32:39, start=2025-01-01T00:00:00, solvedPercentual=22.5, type=LAST_YEAR, totalAnswered=0, totalComplains30=15649, averageAnswerTime3M=0.0, hasStamp=false, dealAgainPercentual=18.2, totalEvaluated=42378, answeredPercentual=0.0, company=7712, end=2025-12-31T23:59:59, id=de8d1738-36c6-407d-b560-34fe60acb65e, status=NOT_RECOMMENDED}', '{averageAnswerTime=8519429.777777778, finalScore=1.9, totalNotAnswered=98307, totalComplains=139323, consumerScore=1.96, created=2026-04-06T03:32:39, start=2024-01-01T00:00:00, solvedPercentual=29.1, type=PAST_LAST_YEAR, totalAnswered=9, totalComplains30=15649, averageAnswerTime3M=0.0, hasStamp=false, dealAgainPercentual=23.1, totalEvaluated=41013, answeredPercentual=0.0, company=7712, end=2024-12-31T23:59:59, id=296a1d53-77a0-4cea-9c91-eed471a54472, status=NOT_RECOMMENDED}', '{averageAnswerTime=8382413.2, finalScore=1.8, totalNotAnswered=331615, totalComplains=447755, consumerScore=1.81, created=2026-04-06T03:32:39, start=2023-04-07T00:00:00, solvedPercentual=27.8, type=LAST_THREE_YEARS, totalAnswered=15, totalComplains30=15649, averageAnswerTime3M=0.0, hasStamp=false, dealAgainPercentual=21.5, totalEvaluated=116136, answeredPercentual=0.0, company=7712, end=2026-04-06T23:59:59, id=c026d9a1-960e-4cc7-9aaf-761d8804d8e3, status=NOT_RECOMMENDED}']",PENDING,claro,São Paulo,,"Assunto: Reclamação Atendimento Técnico<br/><br/>Prezados,<br/><br/>Venho formalizar reclamação sobre dois atendimentos técnicos r",,Reclamação sobre Atendimento Técnico: Serviço Mal Executado,,[],,,False,False,245241951,7712,****,,,****,,****,reclamacao-sobre-atendimento-tecnico-servico-mal-executado_6r3L-tfF3JjmWpSH,False,,False,[],Claro,0000000000000255,"Assunto: Reclamação Atendimento Técnico<br/><br/>Prezados,<br/><br/>Venho formalizar reclamação sobre dois atendimentos técnicos realizados em minha residência em 02/03/2026 e 03/03/2026.<br/><br/>O primeiro técnico, *****, registrou indevidamente a conclusão do serviço e **[Editado pelo Reclame Aqui] minha assinatura**, indicando que o problema havia sido resolvido, o que não ocorreu.<br/><br/>O segundo técnico, *****, solucionou a internet, porém deixou a fiação exposta e desorganizada. Informou que retornaria e solicitou contato via número pessoal, mas não respondeu às mensagens até o momento (06/04/2026).<br/><br/>Solicito providências e a resolução do problema.<br/>",
,,,****,Claro,,False,,,Cobrança indevida de multa por portabilidade após 4 anos com a Tim e inclusão no Serasa,,,,,SC,False,,,2026-04-06T11:18:20,7nST4xHkZQS7VaoT,False,SERVICE_OFF,,****,True,,2026-04-06T11:18:08,MASKED,****,****,False,,,10,,,0000000000000075,****,"['{averageAnswerTime=0.0, finalScore=1.3, totalNotAnswered=75806, totalComplains=92639, consumerScore=1.37, created=2026-04-06T03:32:39, start=2025-10-01T00:00:00, solvedPercentual=19.9, type=SIX_MONTHS, totalAnswered=0, totalComplains30=15649, averageAnswerTime3M=0.0, hasStamp=false, dealAgainPercentual=16.6, totalEvaluated=16833, answeredPercentual=0.0, company=7712, end=2026-03-31T23:59:59, id=37288821-eee6-4b4c-91cb-b45cffcdcf25, status=NOT_RECOMMENDED}', '{averageAnswerTime=0.0, finalScore=1.4, totalNotAnswered=138635, totalComplains=178088, consumerScore=1.43, created=2026-04-06T03:32:39, start=2025-04-01T00:00:00, solvedPercentual=21.0, type=TWELVE_MONTHS, totalAnswered=0, totalComplains30=15649, averageAnswerTime3M=0.0, hasStamp=false, dealAgainPercentual=17.4, totalEvaluated=39453, answeredPercentual=0.0, company=7712, end=2026-03-31T23:59:59, id=35bd6e96-0909-4c57-82df-1fa7a648a76b, status=NOT_RECOMMENDED}', '{averageAnswerTime=0.0, finalScore=1.5, totalNotAnswered=129101, totalComplains=171479, consumerScore=1.51, created=2026-04-06T03:32:39, start=2025-01-01T00:00:00, solvedPercentual=22.5, type=LAST_YEAR, totalAnswered=0, totalComplains30=15649, averageAnswerTime3M=0.0, hasStamp=false, dealAgainPercentual=18.2, totalEvaluated=42378, answeredPercentual=0.0, company=7712, end=2025-12-31T23:59:59, id=de8d1738-36c6-407d-b560-34fe60acb65e, status=NOT_RECOMMENDED}', '{averageAnswerTime=8519429.777777778, finalScore=1.9, totalNotAnswered=98307, totalComplains=139323, consumerScore=1.96, created=2026-04-06T03:32:39, start=2024-01-01T00:00:00, solvedPercentual=29.1, type=PAST_LAST_YEAR, totalAnswered=9, totalComplains30=15649, averageAnswerTime3M=0.0, hasStamp=false, dealAgainPercentual=23.1, totalEvaluated=41013, answeredPercentual=0.0, company=7712, end=2024-12-31T23:59:59, id=296a1d53-77a0-4cea-9c91-eed471a54472, status=NOT_RECOMMENDED}', '{averageAnswerTime=8382413.2, finalScore=1.8, totalNotAnswered=331615, totalComplains=447755, consumerScore=1.81, created=2026-04-06T03:32:39, start=2023-04-07T00:00:00, solvedPercentual=27.8, type=LAST_THREE_YEARS, totalAnswered=15, totalComplains30=15649, averageAnswerTime3M=0.0, hasStamp=false, dealAgainPercentual=21.5, totalEvaluated=116136, answeredPercentual=0.0, company=7712, end=2026-04-06T23:59:59, id=c026d9a1-960e-4cc7-9aaf-761d8804d8e3, status=NOT_RECOMMENDED}']",PENDING,claro,Florianópolis,,"Fiz uma portabilidade a uns 4 anos atrás para a Tim, sendo que fiquei mais de 2 nos com a claro e estão me cobrando multa, isso es",,Cobrança indevida de multa por portabilidade após 4 anos com a Tim e inclusão no Serasa,,[],,,False,False,245241945,7712,****,,0000000000001395,****,,****,cobranca-indevida-de-multa-por-portabilidade-apos-4-anos-com-a-tim-e-inclusao-no-serasa_7nST4xHkZQS7VaoT,False,,False,[],Claro,0000000000000067,"Fiz uma portabilidade a uns 4 anos atrás para a Tim, sendo que fiquei mais de 2 nos com a claro e estão me cobrando multa, isso está errado e indevido já estou recebendo ligações da Serasa peço que resolvam o mais rápido possível e tirem meu nome do Serasa se não procurarei meus direitos legais .",
,,,****,Claro,,False,,,Claro: Assédio telefônico com ligações excessivas e indesejadas para oferta de serviços,,,,,RJ,False,,,2026-04-06T11:17:39,CLqXI5pjwvsCZEJv,False,SERVICE_OFF,,****,True,,2026-04-06T11:17:26,MASKED,****,****,False,,,10,,,000000000000093,****,"['{averageAnswerTime=0.0, finalScore=1.3, totalNotAnswered=75806, totalComplains=92639, consumerScore=1.37, created=2026-04-06T03:32:39, start=2025-10-01T00:00:00, solvedPercentual=19.9, type=SIX_MONTHS, totalAnswered=0, totalComplains30=15649, averageAnswerTime3M=0.0, hasStamp=false, dealAgainPercentual=16.6, totalEvaluated=16833, answeredPercentual=0.0, company=7712, end=2026-03-31T23:59:59, id=37288821-eee6-4b4c-91cb-b45cffcdcf25, status=NOT_RECOMMENDED}', '{averageAnswerTime=0.0, finalScore=1.4, totalNotAnswered=138635, totalComplains=178088, consumerScore=1.43, created=2026-04-06T03:32:39, start=2025-04-01T00:00:00, solvedPercentual=21.0, type=TWELVE_MONTHS, totalAnswered=0, totalComplains30=15649, averageAnswerTime3M=0.0, hasStamp=false, dealAgainPercentual=17.4, totalEvaluated=39453, answeredPercentual=0.0, company=7712, end=2026-03-31T23:59:59, id=35bd6e96-0909-4c57-82df-1fa7a648a76b, status=NOT_RECOMMENDED}', '{averageAnswerTime=0.0, finalScore=1.5, totalNotAnswered=129101, totalComplains=171479, consumerScore=1.51, created=2026-04-06T03:32:39, start=2025-01-01T00:00:00, solvedPercentual=22.5, type=LAST_YEAR, totalAnswered=0, totalComplains30=15649, averageAnswerTime3M=0.0, hasStamp=false, dealAgainPercentual=18.2, totalEvaluated=42378, answeredPercentual=0.0, company=7712, end=2025-12-31T23:59:59, id=de8d1738-36c6-407d-b560-34fe60acb65e, status=NOT_RECOMMENDED}', '{averageAnswerTime=8519429.777777778, finalScore=1.9, totalNotAnswered=98307, totalComplains=139323, consumerScore=1.96, created=2026-04-06T03:32:39, start=2024-01-01T00:00:00, solvedPercentual=29.1, type=PAST_LAST_YEAR, totalAnswered=9, totalComplains30=15649, averageAnswerTime3M=0.0, hasStamp=false, dealAgainPercentual=23.1, totalEvaluated=41013, answeredPercentual=0.0, company=7712, end=2024-12-31T23:59:59, id=296a1d53-77a0-4cea-9c91-eed471a54472, status=NOT_RECOMMENDED}', '{averageAnswerTime=8382413.2, finalScore=1.8, totalNotAnswered=331615, totalComplains=447755, consumerScore=1.81, created=2026-04-06T03:32:39, start=2023-04-07T00:00:00, solvedPercentual=27.8, type=LAST_THREE_YEARS, totalAnswered=15, totalComplains30=15649, averageAnswerTime3M=0.0, hasStamp=false, dealAgainPercentual=21.5, totalEvaluated=116136, answeredPercentual=0.0, company=7712, end=2026-04-06T23:59:59, id=c026d9a1-960e-4cc7-9aaf-761d8804d8e3, status=NOT_RECOMMENDED}']",PENDING,claro,Nova Iguaçu,,Gostaria de registrar minha indignação com a quantidade absurda de ligações que eu tenho recebido da Claro. Todos os dias eu sou i,,Claro: Assédio telefônico com ligações excessivas e indesejadas para oferta de serviços,,[],,,False,False,245241835,7712,****,,0000000000000472,****,,****,claro-assedio-telefonico-com-ligacoes-excessivas-e-indesejadas-para-oferta-de-servicos_CLqXI5pjwvsCZEJv,False,,False,[],Claro,0000000000000066,"Gostaria de registrar minha indignação com a quantidade absurda de ligações que eu tenho recebido da Claro. Todos os dias eu sou incomodado por diversos números diferentes, inclusive fora do horário comercial, oferecendo planos e serviços que nunca solicitei.<br/><br/>Já informei em várias dessas ligações que não sou cliente e que não autorizo contato para ofertas, mas o assédio telefônico continua de forma abusiva e cansativo.<br/><br/>Peço que meu número seja imediatamente removido da base de contatos da Vivo e que cessem todas as ligações promocionais.<br/><br/>Caso a situação não seja resolvido, tomarei as medidas cabíveis junto a Anatel e ao Procon, por se tratar de perturbação reiterada e violação do direito ao sossego.<br/><br/>Aguardo uma solução definitiva.",
,,,****,Claro,,False,,,Cobrança duplicada e não estornada pela Claro - Pagamento de Fatura em Dezembro de 2025,,,,,SP,False,,,2026-04-06T11:17:34,yiFeqwMB5gaKw4wU,False,SERVICE_OFF,,****,True,,2026-04-06T11:17:20,MASKED,****,****,False,,,10,,,0000000000000007,****,"['{averageAnswerTime=0.0, finalScore=1.3, totalNotAnswered=75806, totalComplains=92639, consumerScore=1.37, created=2026-04-06T03:32:39, start=2025-10-01T00:00:00, solvedPercentual=19.9, type=SIX_MONTHS, totalAnswered=0, totalComplains30=15649, averageAnswerTime3M=0.0, hasStamp=false, dealAgainPercentual=16.6, totalEvaluated=16833, answeredPercentual=0.0, company=7712, end=2026-03-31T23:59:59, id=37288821-eee6-4b4c-91cb-b45cffcdcf25, status=NOT_RECOMMENDED}', '{averageAnswerTime=0.0, finalScore=1.4, totalNotAnswered=138635, totalComplains=178088, consumerScore=1.43, created=2026-04-06T03:32:39, start=2025-04-01T00:00:00, solvedPercentual=21.0, type=TWELVE_MONTHS, totalAnswered=0, totalComplains30=15649, averageAnswerTime3M=0.0, hasStamp=false, dealAgainPercentual=17.4, totalEvaluated=39453, answeredPercentual=0.0, company=7712, end=2026-03-31T23:59:59, id=35bd6e96-0909-4c57-82df-1fa7a648a76b, status=NOT_RECOMMENDED}', '{averageAnswerTime=0.0, finalScore=1.5, totalNotAnswered=129101, totalComplains=171479, consumerScore=1.51, created=2026-04-06T03:32:39, start=2025-01-01T00:00:00, solvedPercentual=22.5, type=LAST_YEAR, totalAnswered=0, totalComplains30=15649, averageAnswerTime3M=0.0, hasStamp=false, dealAgainPercentual=18.2, totalEvaluated=42378, answeredPercentual=0.0, company=7712, end=2025-12-31T23:59:59, id=de8d1738-36c6-407d-b560-34fe60acb65e, status=NOT_RECOMMENDED}', '{averageAnswerTime=8519429.777777778, finalScore=1.9, totalNotAnswered=98307, totalComplains=139323, consumerScore=1.96, created=2026-04-06T03:32:39, start=2024-01-01T00:00:00, solvedPercentual=29.1, type=PAST_LAST_YEAR, totalAnswered=9, totalComplains30=15649, averageAnswerTime3M=0.0, hasStamp=false, dealAgainPercentual=23.1, totalEvaluated=41013, answeredPercentual=0.0, company=7712, end=2024-12-31T23:59:59, id=296a1d53-77a0-4cea-9c91-eed471a54472, status=NOT_RECOMMENDED}', '{averageAnswerTime=8382413.2, finalScore=1.8, totalNotAnswered=331615, totalComplains=447755, consumerScore=1.81, created=2026-04-06T03:32:39, start=2023-04-07T00:00:00, solvedPercentual=27.8, type=LAST_THREE_YEARS, totalAnswered=15, totalComplains30=15649, averageAnswerTime3M=0.0, hasStamp=false, dealAgainPercentual=21.5, totalEvaluated=116136, answeredPercentual=0.0, company=7712, end=2026-04-06T23:59:59, id=c026d9a1-960e-4cc7-9aaf-761d8804d8e3, status=NOT_RECOMMENDED}']",PENDING,claro,São Paulo,,"Em dezembro de 2025 paguei a fatura de novembro 2025 de maneira duplicada. Acabei me confundindo pois a Claro, por algum motivo, p",,Cobrança duplicada e não estornada pela Claro - Pagamento de Fatura em Dezembro de 2025,,[],,,False,False,245241823,7712,****,,0000000000001395,****,,****,cobranca-duplicada-e-nao-estornada-pela-claro-pagamento-de-fatura-em-dezembro-de-2025_yiFeqwMB5gaKw4wU,False,,False,[],Claro,0000000000000067,"Em dezembro de 2025 paguei a fatura de novembro 2025 de maneira duplicada. Acabei me confundindo pois a Claro, por algum motivo, parou de me enviar a fatura por e-mail nesse mês. Sem me dar conta, pela busca do e-mail paguei a última, porém não vi que era a mesma de Novembro. <br/>Logo que me dei conta liguei para o atendimento da Claro e me foi orientado que seguisse pagando normalmente: que pagasse normalmente a fatura de dezembro, e que no mês de Janeiro 2026 seria me estornado o valor duplicado através de um desconto na fatura, porém estamos em Abril e ainda não recebi.<br/>Já reclamei para a Claro nesse protocolo: *****<br/>Já reclamei para a ouvidoria duas vezes. Primeiro protocolo: ***** / Segundo: *****<br/>Até agora a Claro não me deu o estorno, sendo que por e-mails enviados nos dias 13 e 16 a Claro afirmou que o pagamento duplicado foi identificado e que o estorno viria na fatura de Abril, que não foi o caso.",
,,,****,Claro,,False,,,Internet Empresarial com Reparo Técnico Pendente Após Múltiplas Solicitações,,,,,RJ,False,,,2026-04-06T11:20:32,pfBiZ0P1C3jSkPNU,False,SERVICE_OFF,,****,True,,2026-04-06T11:20:20,MASKED,****,****,False,,,10,,,0000000000000878,****,"['{averageAnswerTime=0.0, finalScore=1.3, totalNotAnswered=75806, totalComplains=92639, consumerScore=1.37, created=2026-04-06T03:32:39, start=2025-10-01T00:00:00, solvedPercentual=19.9, type=SIX_MONTHS, totalAnswered=0, totalComplains30=15649, averageAnswerTime3M=0.0, hasStamp=false, dealAgainPercentual=16.6, totalEvaluated=16833, answeredPercentual=0.0, company=7712, end=2026-03-31T23:59:59, id=37288821-eee6-4b4c-91cb-b45cffcdcf25, status=NOT_RECOMMENDED}', '{averageAnswerTime=0.0, finalScore=1.4, totalNotAnswered=138635, totalComplains=178088, consumerScore=1.43, created=2026-04-06T03:32:39, start=2025-04-01T00:00:00, solvedPercentual=21.0, type=TWELVE_MONTHS, totalAnswered=0, totalComplains30=15649, averageAnswerTime3M=0.0, hasStamp=false, dealAgainPercentual=17.4, totalEvaluated=39453, answeredPercentual=0.0, company=7712, end=2026-03-31T23:59:59, id=35bd6e96-0909-4c57-82df-1fa7a648a76b, status=NOT_RECOMMENDED}', '{averageAnswerTime=0.0, finalScore=1.5, totalNotAnswered=129101, totalComplains=171479, consumerScore=1.51, created=2026-04-06T03:32:39, start=2025-01-01T00:00:00, solvedPercentual=22.5, type=LAST_YEAR, totalAnswered=0, totalComplains30=15649, averageAnswerTime3M=0.0, hasStamp=false, dealAgainPercentual=18.2, totalEvaluated=42378, answeredPercentual=0.0, company=7712, end=2025-12-31T23:59:59, id=de8d1738-36c6-407d-b560-34fe60acb65e, status=NOT_RECOMMENDED}', '{averageAnswerTime=8519429.777777778, finalScore=1.9, totalNotAnswered=98307, totalComplains=139323, consumerScore=1.96, created=2026-04-06T03:32:39, start=2024-01-01T00:00:00, solvedPercentual=29.1, type=PAST_LAST_YEAR, totalAnswered=9, totalComplains30=15649, averageAnswerTime3M=0.0, hasStamp=false, dealAgainPercentual=23.1, totalEvaluated=41013, answeredPercentual=0.0, company=7712, end=2024-12-31T23:59:59, id=296a1d53-77a0-4cea-9c91-eed471a54472, status=NOT_RECOMMENDED}', '{averageAnswerTime=8382413.2, finalScore=1.8, totalNotAnswered=331615, totalComplains=447755, consumerScore=1.81, created=2026-04-06T03:32:39, start=2023-04-07T00:00:00, solvedPercentual=27.8, type=LAST_THREE_YEARS, totalAnswered=15, totalComplains30=15649, averageAnswerTime3M=0.0, hasStamp=false, dealAgainPercentual=21.5, totalEvaluated=116136, answeredPercentual=0.0, company=7712, end=2026-04-06T23:59:59, id=c026d9a1-960e-4cc7-9aaf-761d8804d8e3, status=NOT_RECOMMENDED}']",PENDING,claro,Rio de Janeiro,,"Já solicitei reparo técnico para a internet duas vezes, mas ninguém resolveu ainda.<br/>O protocolo do último atendimento é *****.",,Internet Empresarial com Reparo Técnico Pendente Após Múltiplas Solicitações,,[],,,False,False,245242329,7712,****,,0000000000000476,****,,****,internet-empresarial-com-reparo-tecnico-pendente-apos-multiplas-solicitacoes_pfBiZ0P1C3jSkPNU,False,,False,[],Claro,0000000000000069,"Já solicitei reparo técnico para a internet duas vezes, mas ninguém resolveu ainda.<br/>O protocolo do último atendimento é *****. <br/>É internet empresarial e está causando muitos transtornos.",
,,,****,Claro,,False,,telefone móvel,Cobrança a mais,,,,,DF,False,,,2026-04-06T11:19:02,ig4NNaORvZwjX3wB,False,,,****,True,,2026-04-06T11:18:51,MASKED,****,****,False,,,0,,,0000000000000075,****,"['{averageAnswerTime=0.0, finalScore=1.3, totalNotAnswered=75806, totalComplains=92639, consumerScore=1.37, created=2026-04-06T03:32:39, start=2025-10-01T00:00:00, solvedPercentual=19.9, type=SIX_MONTHS, totalAnswered=0, totalComplains30=15649, averageAnswerTime3M=0.0, hasStamp=false, dealAgainPercentual=16.6, totalEvaluated=16833, answeredPercentual=0.0, company=7712, end=2026-03-31T23:59:59, id=37288821-eee6-4b4c-91cb-b45cffcdcf25, status=NOT_RECOMMENDED}', '{averageAnswerTime=0.0, finalScore=1.4, totalNotAnswered=138635, totalComplains=178088, consumerScore=1.43, created=2026-04-06T03:32:39, start=2025-04-01T00:00:00, solvedPercentual=21.0, type=TWELVE_MONTHS, totalAnswered=0, totalComplains30=15649, averageAnswerTime3M=0.0, hasStamp=false, dealAgainPercentual=17.4, totalEvaluated=39453, answeredPercentual=0.0, company=7712, end=2026-03-31T23:59:59, id=35bd6e96-0909-4c57-82df-1fa7a648a76b, status=NOT_RECOMMENDED}', '{averageAnswerTime=0.0, finalScore=1.5, totalNotAnswered=129101, totalComplains=171479, consumerScore=1.51, created=2026-04-06T03:32:39, start=2025-01-01T00:00:00, solvedPercentual=22.5, type=LAST_YEAR, totalAnswered=0, totalComplains30=15649, averageAnswerTime3M=0.0, hasStamp=false, dealAgainPercentual=18.2, totalEvaluated=42378, answeredPercentual=0.0, company=7712, end=2025-12-31T23:59:59, id=de8d1738-36c6-407d-b560-34fe60acb65e, status=NOT_RECOMMENDED}', '{averageAnswerTime=8519429.777777778, finalScore=1.9, totalNotAnswered=98307, totalComplains=139323, consumerScore=1.96, created=2026-04-06T03:32:39, start=2024-01-01T00:00:00, solvedPercentual=29.1, type=PAST_LAST_YEAR, totalAnswered=9, totalComplains30=15649, averageAnswerTime3M=0.0, hasStamp=false, dealAgainPercentual=23.1, totalEvaluated=41013, answeredPercentual=0.0, company=7712, end=2024-12-31T23:59:59, id=296a1d53-77a0-4cea-9c91-eed471a54472, status=NOT_RECOMMENDED}', '{averageAnswerTime=8382413.2, finalScore=1.8, totalNotAnswered=331615, totalComplains=447755, consumerScore=1.81, created=2026-04-06T03:32:39, start=2023-04-07T00:00:00, solvedPercentual=27.8, type=LAST_THREE_YEARS, totalAnswered=15, totalComplains30=15649, averageAnswerTime3M=0.0, hasStamp=false, dealAgainPercentual=21.5, totalEvaluated=116136, answeredPercentual=0.0, company=7712, end=2026-04-06T23:59:59, id=c026d9a1-960e-4cc7-9aaf-761d8804d8e3, status=NOT_RECOMMENDED}']",PENDING,claro,Brasília,,Bom dia em primeiro de dezembro deste ano fiz um contrato com a Clara na pessoa do Senhor Yan no valor de 8490 de dezembro até hoj,,Cobrança a mais,,[],,,False,False,245242095,7712,****,False,,****,,****,cobranca-a-mais_ig4NNaORvZwjX3wB,False,,False,['AUDIO_TRANSCRIPTION'],Claro,0000000000000000,"Bom dia em primeiro de dezembro deste ano fiz um contrato com a Clara na pessoa do Senhor Yan no valor de 8490 de dezembro até hoje dia 6 de Abril, vem sempre sendo corrigido, eu sempre ligo para reclamar e eles fazem a correção hoje no dia 6 de Abril. Eu liguei para reclamar eles não fizeram a correção dizendo que eu tinha que aguardar prazo, vale ou no vale o protocolo do Senhor Ian é essa Claro ela tira a paz é paciência e Saúde da gente.",
,,,****,Claro,Outro problema,False,,Outro Tipo de produto/Serviço,COBRANÇA INDEVIDA,,,,,PR,False,,,2026-04-06T11:18:49,Xtb0Mw-HdPG8ywzw,False,SERVICE_OFF,,****,True,,2026-04-06T11:18:37,MASKED,****,****,False,,,10,,,,****,"['{averageAnswerTime=0.0, finalScore=1.3, totalNotAnswered=75806, totalComplains=92639, consumerScore=1.37, created=2026-04-06T03:32:39, start=2025-10-01T00:00:00, solvedPercentual=19.9, type=SIX_MONTHS, totalAnswered=0, totalComplains30=15649, averageAnswerTime3M=0.0, hasStamp=false, dealAgainPercentual=16.6, totalEvaluated=16833, answeredPercentual=0.0, company=7712, end=2026-03-31T23:59:59, id=37288821-eee6-4b4c-91cb-b45cffcdcf25, status=NOT_RECOMMENDED}', '{averageAnswerTime=0.0, finalScore=1.4, totalNotAnswered=138635, totalComplains=178088, consumerScore=1.43, created=2026-04-06T03:32:39, start=2025-04-01T00:00:00, solvedPercentual=21.0, type=TWELVE_MONTHS, totalAnswered=0, totalComplains30=15649, averageAnswerTime3M=0.0, hasStamp=false, dealAgainPercentual=17.4, totalEvaluated=39453, answeredPercentual=0.0, company=7712, end=2026-03-31T23:59:59, id=35bd6e96-0909-4c57-82df-1fa7a648a76b, status=NOT_RECOMMENDED}', '{averageAnswerTime=0.0, finalScore=1.5, totalNotAnswered=129101, totalComplains=171479, consumerScore=1.51, created=2026-04-06T03:32:39, start=2025-01-01T00:00:00, solvedPercentual=22.5, type=LAST_YEAR, totalAnswered=0, totalComplains30=15649, averageAnswerTime3M=0.0, hasStamp=false, dealAgainPercentual=18.2, totalEvaluated=42378, answeredPercentual=0.0, company=7712, end=2025-12-31T23:59:59, id=de8d1738-36c6-407d-b560-34fe60acb65e, status=NOT_RECOMMENDED}', '{averageAnswerTime=8519429.777777778, finalScore=1.9, totalNotAnswered=98307, totalComplains=139323, consumerScore=1.96, created=2026-04-06T03:32:39, start=2024-01-01T00:00:00, solvedPercentual=29.1, type=PAST_LAST_YEAR, totalAnswered=9, totalComplains30=15649, averageAnswerTime3M=0.0, hasStamp=false, dealAgainPercentual=23.1, totalEvaluated=41013, answeredPercentual=0.0, company=7712, end=2024-12-31T23:59:59, id=296a1d53-77a0-4cea-9c91-eed471a54472, status=NOT_RECOMMENDED}', '{averageAnswerTime=8382413.2, finalScore=1.8, totalNotAnswered=331615, totalComplains=447755, consumerScore=1.81, created=2026-04-06T03:32:39, start=2023-04-07T00:00:00, solvedPercentual=27.8, type=LAST_THREE_YEARS, totalAnswered=15, totalComplains30=15649, averageAnswerTime3M=0.0, hasStamp=false, dealAgainPercentual=21.5, totalEvaluated=116136, answeredPercentual=0.0, company=7712, end=2026-04-06T23:59:59, id=c026d9a1-960e-4cc7-9aaf-761d8804d8e3, status=NOT_RECOMMENDED}']",PENDING,claro,Curitiba,,"Tentei fazer um plano mais em conta para minha empresa na Claro e os atendentes não tinham nenhum plano que fosse mais em conta, e",,COBRANÇA INDEVIDA,,[],,,False,False,245242049,7712,****,,,****,,****,cobranca-indevida_Xtb0Mw-HdPG8ywzw,False,,False,[],Claro,,"Tentei fazer um plano mais em conta para minha empresa na Claro e os atendentes não tinham nenhum plano que fosse mais em conta, então fiz a portabilidade para TIM, e agora estão me cobrando uma multa de quebra de contrato, sendo que fiz portabilidade, gostaria que fosse cancelado essa multa das duas linhas minhas que estão no meu CPF, pois tentei entrar em contato para continuar com a Claro mais não fazem questão, ai quando fazemos a troca de operadora ficam iguais [Editado pelo Reclame Aqui] ligando e ainda mandam multa.",
